{
  "planVersion": "1.0",
  "checkId": "CHK-005",
  "checkName": "Financial Resilience, Affordability and Liquidity",
  "primaryCategories": [
    "B",
    "C",
    "F",
    "I"
  ],
  "triggerProbe": {
    "triggerField": "checkTriggers.hasCapitalContributionsOrWithdrawals",
    "applicability": [
      {
        "capitalContributionsOrWithdrawals": [
          "true"
        ],
        "canonicalPaths": [
          "/checkTriggers/hasCapitalContributionsOrWithdrawals"
        ]
      }
    ],
    "queries": [
      {
        "id": "T5.1",
        "text": "amount to be invested regular contributions withdrawals and adviser charges",
        "side": "Either",
        "targetCategories": [
          "I",
          "H"
        ],
        "expectSignals": [
          "invest",
          "contribution",
          "withdrawal",
          "charge",
          "fee",
          "£"
        ],
        "priority": "Core"
      }
    ],
    "absentWhen": "The recommendation involves no capital, contributions, withdrawals or charges.",
    "onAbsent": "Skip"
  },
  "queryGroups": [
    {
      "groupId": "G5.1",
      "requirement": "Affordability of initial and ongoing commitments",
      "declares": {
        "assertionCategories": [
          "I"
        ],
        "evidenceCategories": [
          "B",
          "F"
        ]
      },
      "retrieval": {
        "canonicalPaths": [
          "/financialPosition/affordabilityAssessment"
        ],
        "evidenceSections": [
          "Total Monthly Disposable Income",
          "Current Monthly Cash Flow"
        ],
        "queries": [
          {
            "id": "Q5.1.1",
            "text": "initial adviser fee and ongoing annual charge in monetary terms payable by you",
            "side": "Assertion",
            "targetCategories": [
              "I"
            ],
            "expectSignals": [
              "initial",
              "ongoing",
              "£",
              "%",
              "per annum"
            ],
            "canonicalPaths": [
              "/financialPosition/affordabilityAssessment/initialCommitment"
            ],
            "priority": "Core"
          },
          {
            "id": "Q5.1.2",
            "text": "monthly contribution you will pay into the plan regular premium",
            "side": "Either",
            "targetCategories": [
              "I",
              "H"
            ],
            "expectSignals": [
              "per month",
              "monthly",
              "contribution",
              "premium"
            ],
            "priority": "Core"
          },
          {
            "id": "Q5.1.3",
            "text": "the contributions are affordable based on your income and expenditure",
            "side": "Assertion",
            "targetCategories": [
              "I"
            ],
            "expectSignals": [
              "afford",
              "affordable",
              "sustainable",
              "within your means"
            ],
            "priority": "Core"
          },
          {
            "id": "Q5.1.4",
            "text": "disposable income surplus available each month after expenditure",
            "side": "Evidence",
            "targetCategories": [
              "B",
              "F"
            ],
            "expectSignals": [
              "surplus",
              "disposable",
              "available",
              "left over"
            ],
            "priority": "Core"
          },
          {
            "id": "Q5.1.5",
            "text": "fees will be paid from the plan rather than directly by the client facilitated",
            "side": "Either",
            "targetCategories": [
              "I",
              "A"
            ],
            "expectSignals": [
              "facilitated",
              "deducted from",
              "paid via",
              "from the plan"
            ],
            "priority": "Core"
          }
        ]
      },
      "verification": {
        "limb": "Consistency",
        "issueCategories": [
          "Data inconsistency",
          "Data quality"
        ],
        "comparison": {
          "method": "ValueMatch",
          "falsePositiveGuards": [
            "Fees taken from the fund reduce the investment, not the client's income — do not test them against monthly surplus.",
            "A one-off transfer of existing pension money is not a new affordability commitment."
          ]
        },
        "sufficiency": {
          "ifAssertionAbsent": "Note as a gap where a new ongoing commitment is created from income.",
          "ifEvidenceAbsent": "Potential Concern: affordability asserted with no income and expenditure record."
        }
      }
    },
    {
      "groupId": "G5.2",
      "requirement": "Financial situation plus cashflow supports the recommendation",
      "declares": {
        "assertionCategories": [
          "I"
        ],
        "evidenceCategories": [
          "B",
          "F"
        ]
      },
      "retrieval": {
        "canonicalPaths": [
          "/financialPosition/totals",
          "/needsAnalysis/scenarios[]",
          "/needsAnalysis/assumptions[]",
          "/needsAnalysis/lifeExpectancyBasis"
        ],
        "evidenceSections": [
          "Total Monthly Disposable Income",
          "Total Net Monthly Income",
          "Residency Status",
          "cashflow modeller"
        ],
        "queries": [
          {
            "id": "Q5.2.1",
            "text": "cashflow modelling projection of income and expenditure year on year to age",
            "side": "Either",
            "targetCategories": [
              "I",
              "F"
            ],
            "expectSignals": [
              "cashflow",
              "projection",
              "modelled",
              "to age",
              "forecast"
            ],
            "priority": "Core"
          },
          {
            "id": "Q5.2.2",
            "text": "cashflow assumptions inflation rate growth rate used in the plan",
            "side": "Either",
            "targetCategories": [
              "F",
              "I"
            ],
            "expectSignals": [
              "inflation",
              "growth rate",
              "assumption",
              "%"
            ],
            "canonicalPaths": [
              "/needsAnalysis/assumptions[]"
            ],
            "priority": "Core"
          },
          {
            "id": "Q5.2.3",
            "text": "figures entered into the cashflow model income sources and expenditure",
            "side": "Either",
            "targetCategories": [
              "F",
              "I",
              "B"
            ],
            "expectSignals": [
              "we have input",
              "entered",
              "included",
              "per week",
              "per annum"
            ],
            "priority": "Core"
          },
          {
            "id": "Q5.2.4",
            "text": "no shortfall projected throughout your lifetime funds last",
            "side": "Either",
            "targetCategories": [
              "I",
              "F"
            ],
            "expectSignals": [
              "shortfall",
              "no shortfall",
              "sustainable",
              "run out",
              "last"
            ],
            "priority": "Core"
          },
          {
            "id": "Q5.2.5",
            "text": "total net monthly income total monthly expenditure total monthly disposable income",
            "side": "Evidence",
            "targetCategories": [
              "B"
            ],
            "expectSignals": [
              "disposable",
              "total monthly",
              "net monthly income",
              "expenditure"
            ],
            "priority": "Core"
          },
          {
            "id": "Q5.2.6",
            "text": "the forecast incorporates the assets of your main residence and cash holdings",
            "side": "Either",
            "targetCategories": [
              "I",
              "F"
            ],
            "expectSignals": [
              "main residence",
              "incorporates",
              "property",
              "cash holdings",
              "assets"
            ],
            "priority": "Core"
          },
          {
            "id": "Q5.2.7",
            "text": "address line city postcode address type residency status registered on electoral roll time at address",
            "side": "Evidence",
            "targetCategories": [
              "B"
            ],
            "expectSignals": [
              "Residency Status",
              "Tenant",
              "Address Type",
              "Postcode"
            ],
            "priority": "Core"
          }
        ]
      },
      "verification": {
        "limb": "Consistency",
        "issueCategories": [
          "Data inconsistency",
          "Weak justification"
        ],
        "comparison": {
          "method": "ValueMatch",
          "tolerance": "Every figure the report says was modelled must match the fact find within 5%.",
          "falsePositiveGuards": [
            "Growth assumptions differ legitimately between a cashflow model and a provider illustration — flag only where the report relies on both without explanation.",
            "Charts are not reliably parsable; do not conclude from a chart caption alone.",
            "An input the client does not have is a defect in the model, not a rounding difference. A modelled main residence for a renting client overstates the resources the plan rests on."
          ]
        },
        "sufficiency": {
          "ifEvidenceAbsent": "Note that cashflow conclusions are asserted with no modelling output on file."
        }
      }
    },
    {
      "groupId": "G5.3",
      "requirement": "Emergency fund and liquidity needs, foreseeable and unforeseeable",
      "declares": {